children of Israel, saying, He that offereth the sacrifice of hispeace offerings unto the LORD shall bring his oblation unto the LORDof the sacrifice of his peace offerings.
His own hands shall bring the offerings of the LORD made by fire,the fat with the breast, it shall he bring, that the breast may bewaved for a wave offering before the LORD.
And the priest shall burn the fat upon the altar: but the breastshall be Aaron’s and his sons’.And the right shoulder shall ye give unto the priest for an heave
offering of the sacrifices of your peace offerings.He among the sons of Aaron, that offereth the blood of the peaceofferings, and the fat, shall have the right shoulder for his part.
For the wave breast and the heave shoulder have I taken of thechildren of Israel from off the sacrifices of their peace offerings,and have given them unto Aaron the priest and unto his sons by a
statute for ever from among the children of Israel.This is the portion of the anointing of Aaron, and of theanointing of his sons, out of the offerings of the LORD made by fire,
in the day when he presented them to minister unto the LORD in thepriest’s office; 7:36 Which the LORD commanded to be given them of thechildren of Israel, in the day that he anointed them, by a statute for
ever throughout their generations.This is the law of the burnt offering, of the meat offering, andof the sin offering, and of the trespass offering, and of the
consecrations, and of the sacrifice of the peace offerings; 7:38 Whichthe LORD commanded Moses in mount Sinai, in the day that he commandedthe children of Israel to offer their oblations unto the LORD, in the
wilderness of Sinai.And the LORD spake unto Moses, saying, 8:2 Take Aaron and his sonswith him, and the garments, and the anointing oil, and a bullock for
the sin offering, and two rams, and a basket of unleavened bread; 8:3And gather thou all the congregation together unto the door of thetabernacle of the congregation.
And Moses did as the LORD commanded him; and the assembly wasgathered together unto the door of the tabernacle of the congregation.And Moses said unto the congregation, This is the thing which the
LORD commanded to be done.And Moses brought Aaron and his sons, and washed them with water.And he put upon him the coat, and girded him with the girdle, and
clothed him with the robe, and put the ephod upon him, and he girdedhim with the curious girdle of the ephod, and bound it unto himtherewith.
And he put the breastplate upon him: also he put in thebreastplate the Urim and the Thummim.And he put the mitre upon his head; also upon the mitre, even upon
his forefront, did he put the golden plate, the holy crown; as theLORD commanded Moses.And Moses took the anointing oil, and anointed the tabernacle and
all that was therein, and sanctified them.And he sprinkled thereof upon the altar seven times, and anointedthe altar and all his vessels, both the laver and his foot, to
sanctify them.And he poured of the anointing oil upon Aaron’s head, andanointed him, to sanctify him.
And Moses brought Aaron’s sons, and put coats upon them, andgirded them with girdles, and put bonnets upon them; as the LORDcommanded Moses.
And he brought the bullock for the sin offering: and Aaron andhis sons laid their hands upon the head of the bullock for the sinoffering.
And he slew it; and Moses took the blood, and put it upon thehorns of the altar round about with his finger, and purified thealtar, and poured the blood at the bottom of the altar, and sanctified
it, to make reconciliation upon it.And he took all the fat that was upon the inwards, and the caulabove the liver, and the two kidneys, and their fat, and Moses burned
it upon the altar.But the bullock, and his hide, his flesh, and his dung, he burntwith fire without the camp; as the LORD commanded Moses.
And he brought the ram for the burnt offering: and Aaron and hissons laid their hands upon the head of the ram.And he killed it; and Moses sprinkled the blood upon the altar
round about.And he cut the ram into pieces; and Moses burnt the head, and thepieces, and the fat.
And he washed the inwards and the legs in water; and Moses burntthe whole ram upon the altar: it was a burnt sacrifice for a sweetsavour, and an offering made by fire unto the LORD; as the LORD